<?xml version="1.0" encoding="UTF-8" ?>
<xs:schema xmlns:xs="http://www.w3.org/2001/XMLSchema">
    <xs:element name="candies">
        <xs:complexType>
            <xs:sequence>
                <xs:element name="candy" maxOccurs="unbounded" minOccurs="0">
                    <xs:complexType>
                        <xs:sequence>
                            <xs:element name="Name" type="xs:string"/>
                            <xs:element name="Energy" type="xs:positiveInteger"/>
                            <xs:element name="Type" type="Type" minOccurs="1"/>
                            <xs:element name="Ingredients">
                                <xs:complexType>
                                    <xs:sequence>
                                        <xs:element name="Ingredient" minOccurs="1" maxOccurs="unbounded">
                                            <xs:complexType>
                                                <xs:attribute name="IName" type="xs:string"/>
                                                <xs:attribute name="Amount" type="xs:double"/>
                                            </xs:complexType>
                                        </xs:element>
                                    </xs:sequence>
                                </xs:complexType>
                            </xs:element>
                            <xs:element name="Value">
                                <xs:complexType>
                                    <xs:sequence>
                                        <xs:element name="Proteins" type="xs:double"/>
                                        <xs:element name="Fats" type="xs:double"/>
                                        <xs:element name="CarbonHydrates" type="xs:double"/>
                                    </xs:sequence>
                                </xs:complexType>
                            </xs:element>
                            <xs:element name="Production" type="xs:string"/>
                        </xs:sequence>
                        <xs:attribute name="ID" type="xs:unsignedInt" use="required"/>
                    </xs:complexType>
                </xs:element>
            </xs:sequence>
        </xs:complexType>
    </xs:element>
    <xs:simpleType name="Type">
        <xs:restriction base="xs:string">
            <xs:enumeration value="Caramel"/>
            <xs:enumeration value="iris"/>
            <xs:enumeration value="chocolate without filling"/>
            <xs:enumeration value="chocolate with filling"/>
        </xs:restriction>
    </xs:simpleType>

</xs:schema>